{
  "id": "chair",
  "name": "Chair",
  "description": "Four legs, seat, backrest, two stretchers. chair.back is selectable. Not a stool: stool has no back.",
  "tags": ["furniture", "wood", "seat", "back"],
  "target_tris": 96,
  "parts": [
    {
      "name": "leg_fl",
      "primitive": "cube",
      "size": [0.05, 0.05, 0.42],
      "location": [-0.16, -0.16, 0.21],
      "color": "#4a2c17"
    },
    {
      "name": "leg_fr",
      "primitive": "cube",
      "size": [0.05, 0.05, 0.42],
      "location": [0.16, -0.16, 0.21],
      "color": "#4a2c17"
    },
    {
      "name": "leg_bl",
      "primitive": "cube",
      "size": [0.05, 0.05, 0.42],
      "location": [-0.16, 0.16, 0.21],
      "color": "#4a2c17"
    },
    {
      "name": "leg_br",
      "primitive": "cube",
      "size": [0.05, 0.05, 0.42],
      "location": [0.16, 0.16, 0.21],
      "color": "#4a2c17"
    },
    {
      "name": "seat",
      "primitive": "cube",
      "size": [0.4, 0.4, 0.05],
      "location": [0, 0, 0.445],
      "color": "#8c6239"
    },
    {
      "name": "back",
      "primitive": "cube",
      "size": [0.4, 0.05, 0.48],
      "location": [0, 0.175, 0.71],
      "color": "#7a5429"
    },
    {
      "name": "stretcher_l",
      "primitive": "cube",
      "size": [0.04, 0.32, 0.04],
      "location": [-0.16, 0, 0.16],
      "color": "#4a2c17"
    },
    {
      "name": "stretcher_r",
      "primitive": "cube",
      "size": [0.04, 0.32, 0.04],
      "location": [0.16, 0, 0.16],
      "color": "#4a2c17"
    }
  ]
}
