{
  "id": "table",
  "name": "Table",
  "description": "Four legs and a rectangular top.",
  "tags": ["furniture", "wood", "tavern"],
  "target_tris": 60,
  "parts": [
    {
      "name": "leg_fl",
      "primitive": "cube",
      "size": [0.08, 0.08, 0.7],
      "location": [-0.7, -0.32, 0.35],
      "color": "#4a2c17"
    },
    {
      "name": "leg_fr",
      "primitive": "cube",
      "size": [0.08, 0.08, 0.7],
      "location": [0.7, -0.32, 0.35],
      "color": "#4a2c17"
    },
    {
      "name": "leg_bl",
      "primitive": "cube",
      "size": [0.08, 0.08, 0.7],
      "location": [-0.7, 0.32, 0.35],
      "color": "#4a2c17"
    },
    {
      "name": "leg_br",
      "primitive": "cube",
      "size": [0.08, 0.08, 0.7],
      "location": [0.7, 0.32, 0.35],
      "color": "#4a2c17"
    },
    {
      "name": "top",
      "primitive": "cube",
      "size": [1.6, 0.8, 0.06],
      "location": [0, 0, 0.73],
      "color": "#8c6239"
    }
  ]
}
