{
  "id": "crate_battens",
  "name": "Crate with lid battens",
  "description": "Lidded crate plus two lid battens for a sturdier shipping look.",
  "tags": ["storage", "wood", "shipping"],
  "target_tris": 96,
  "parts": [
    {
      "name": "floor",
      "primitive": "cube",
      "size": [0.8, 0.6, 0.04],
      "location": [0, 0, 0.02],
      "color": "#4a2c17"
    },
    {
      "name": "wall_front",
      "primitive": "cube",
      "size": [0.8, 0.04, 0.42],
      "location": [0, -0.28, 0.25],
      "color": "#7a5429"
    },
    {
      "name": "wall_back",
      "primitive": "cube",
      "size": [0.8, 0.04, 0.42],
      "location": [0, 0.28, 0.25],
      "color": "#7a5429"
    },
    {
      "name": "wall_left",
      "primitive": "cube",
      "size": [0.04, 0.52, 0.42],
      "location": [-0.38, 0, 0.25],
      "color": "#6b4622"
    },
    {
      "name": "wall_right",
      "primitive": "cube",
      "size": [0.04, 0.52, 0.42],
      "location": [0.38, 0, 0.25],
      "color": "#6b4622"
    },
    {
      "name": "lid",
      "primitive": "cube",
      "size": [0.84, 0.64, 0.05],
      "location": [0, 0, 0.485],
      "color": "#8c6239"
    },
    {
      "name": "batten_a",
      "primitive": "cube",
      "size": [0.08, 0.62, 0.03],
      "location": [-0.18, 0, 0.525],
      "color": "#4a2c17"
    },
    {
      "name": "batten_b",
      "primitive": "cube",
      "size": [0.08, 0.62, 0.03],
      "location": [0.18, 0, 0.525],
      "color": "#4a2c17"
    }
  ]
}
