{
  "id": "fountain",
  "name": "Fountain",
  "description": "Village fountain: basin, column, spout, and water. fountain.spout is selectable.",
  "tags": [
    "outdoor",
    "water",
    "village",
    "stone"
  ],
  "target_tris": 48,
  "parts": [
    {
      "name": "basin",
      "primitive": "cube",
      "size": [
        0.8,
        0.8,
        0.16
      ],
      "location": [
        0,
        0,
        0.08
      ],
      "color": "#6a6a70"
    },
    {
      "name": "column",
      "primitive": "cube",
      "size": [
        0.16,
        0.16,
        0.4
      ],
      "location": [
        0,
        0,
        0.36
      ],
      "color": "#4a4a50"
    },
    {
      "name": "spout",
      "primitive": "cube",
      "size": [
        0.12,
        0.12,
        0.08
      ],
      "location": [
        0,
        0,
        0.6
      ],
      "color": "#3a3a40"
    },
    {
      "name": "water",
      "primitive": "cube",
      "size": [
        0.7,
        0.7,
        0.04
      ],
      "location": [
        0,
        0,
        0.14
      ],
      "color": "#3a5a7a"
    }
  ]
}
