{
  "id": "sword",
  "name": "Sword",
  "description": "Arming sword: blade, guard, grip, pommel. sword.blade is a cube.",
  "tags": [
    "armory",
    "weapon",
    "metal"
  ],
  "target_tris": 48,
  "parts": [
    {
      "name": "blade",
      "primitive": "cube",
      "size": [
        0.5,
        0.04,
        0.08
      ],
      "location": [
        0.18,
        0,
        0.06
      ],
      "color": "#5a5a62"
    },
    {
      "name": "guard",
      "primitive": "cube",
      "size": [
        0.04,
        0.16,
        0.04
      ],
      "location": [
        -0.08,
        0,
        0.06
      ],
      "color": "#3a3a40"
    },
    {
      "name": "grip",
      "primitive": "cube",
      "size": [
        0.1,
        0.035,
        0.035
      ],
      "location": [
        -0.15,
        0,
        0.06
      ],
      "color": "#4a2c17"
    },
    {
      "name": "pommel",
      "primitive": "cube",
      "size": [
        0.05,
        0.05,
        0.05
      ],
      "location": [
        -0.22,
        0,
        0.06
      ],
      "color": "#2c2c30"
    }
  ]
}
