{
  "id": "lever",
  "name": "Lever",
  "description": "Dungeon lever: slot, handle, and knob. lever.handle is selectable.",
  "tags": [
    "dungeon",
    "tool",
    "metal"
  ],
  "target_tris": 48,
  "parts": [
    {
      "name": "base",
      "primitive": "cube",
      "size": [
        0.16,
        0.1,
        0.08
      ],
      "location": [
        0,
        0,
        0.04
      ],
      "color": "#6a6a70"
    },
    {
      "name": "slot",
      "primitive": "cube",
      "size": [
        0.04,
        0.04,
        0.16
      ],
      "location": [
        0,
        0,
        0.14
      ],
      "color": "#3a3a40"
    },
    {
      "name": "handle",
      "primitive": "cube",
      "size": [
        0.04,
        0.04,
        0.22
      ],
      "location": [
        0.08,
        0,
        0.28
      ],
      "color": "#4a2c17"
    },
    {
      "name": "knob",
      "primitive": "cube",
      "size": [
        0.05,
        0.05,
        0.05
      ],
      "location": [
        0.08,
        0,
        0.4
      ],
      "color": "#5a5a62"
    }
  ]
}
