{
  "id": "lantern",
  "name": "Lantern",
  "description": "Post lantern with a cube housing and a small roof.",
  "tags": ["light", "props", "outdoor"],
  "target_tris": 60,
  "parts": [
    {
      "name": "base",
      "primitive": "cube",
      "size": [0.22, 0.22, 0.04],
      "location": [0, 0, 0.02],
      "color": "#3a3a40"
    },
    {
      "name": "post",
      "primitive": "cube",
      "size": [0.05, 0.05, 0.55],
      "location": [0, 0, 0.315],
      "color": "#3a3a40"
    },
    {
      "name": "housing",
      "primitive": "cube",
      "size": [0.18, 0.18, 0.22],
      "location": [0, 0, 0.7],
      "color": "#d9c27a"
    },
    {
      "name": "roof",
      "primitive": "cube",
      "size": [0.24, 0.24, 0.05],
      "location": [0, 0, 0.835],
      "color": "#3a3a40"
    },
    {
      "name": "cap",
      "primitive": "cube",
      "size": [0.06, 0.06, 0.08],
      "location": [0, 0, 0.9],
      "color": "#3a3a40"
    }
  ]
}
